{
  "bundleId": "DISC-TEST-REASON@5c843c6d9355",
  "kind": "RULE",
  "scope": "GLOBAL",
  "ruleVersionId": "DISC-TEST-REASON",
  "applyFrom": "2027-01-01",
  "supersedes": {
    "ruleVersionId": "DISC-2026-07"
  },
  "body": {
    "minCompare": 3,
    "distinctInsurer": true,
    "gradeRequired": {
      "whenLargeGa": true
    },
    "allowedGradingPolicies": [
      "GRADING-2026-07"
    ],
    "allowedRankingPolicies": [
      "RANK-2026-07"
    ],
    "allowedTieBreaks": [
      "SHARED_RANK",
      "STRICT"
    ],
    "snapshotMaxAgeDays": 7,
    "reasonCodes": [
      {
        "code": "COVERAGE",
        "label": "보장수준"
      },
      {
        "code": "PREMIUM",
        "label": "보험료"
      },
      {
        "code": "PURPOSE",
        "label": "가입목적"
      },
      {
        "code": "OTHER",
        "label": "기타",
        "requiresText": true
      },
      {
        "code": "CUSTOMER_REQUEST",
        "label": "고객 요청 보험사",
        "auto": true
      },
      {
        "code": "TEST_ONLY_REASON",
        "label": "테스트 전용 사유(가상)"
      }
    ],
    "reasonTextMaxLength": 500,
    "voidReasons": [
      {
        "code": "CUSTOMER_CANCELLED",
        "label": "고객 상담 취소"
      },
      {
        "code": "WRITTEN_IN_ERROR",
        "label": "작성 오류"
      },
      {
        "code": "DUPLICATE",
        "label": "중복 작성"
      },
      {
        "code": "OTHER",
        "label": "기타",
        "requiresText": true
      }
    ],
    "supersedeReasons": [
      {
        "code": "CONTENT_ERROR",
        "label": "기재 내용 오류"
      },
      {
        "code": "PRODUCT_DATA_CORRECTED",
        "label": "상품 정보 정정"
      },
      {
        "code": "OTHER",
        "label": "기타",
        "requiresText": true
      }
    ],
    "lifecycleReasonTextMaxLength": 500,
    "signerSet": [
      "CUSTOMER",
      "AGENT",
      "MANAGER"
    ],
    "signOrder": "SEQUENTIAL",
    "managerConfirmMode": "REQUIRED",
    "signDeadlineDays": 7,
    "gateRequiresManager": true,
    "remoteLinkTtlHours": 72,
    "sessionTtlMinutes": {
      "TOUCH_PAD": 30,
      "PAPER_SCAN": 10080
    },
    "agentSignMethod": "DRAWN",
    "channels": {
      "TOUCH_PAD": {
        "enabled": true
      },
      "REMOTE_LINK": {
        "enabled": true
      },
      "PAPER_SCAN": {
        "enabled": true,
        "requiresManagerReview": true
      },
      "CERTIFIED_ESIGN": {
        "enabled": false
      }
    },
    "identityCheck": {
      "REMOTE_LINK": [
        "LINK_POSSESSION",
        "BIRTH_DATE"
      ],
      "TOUCH_PAD": [
        "AGENT_FACE_TO_FACE",
        "SCROLL_COMPLETE"
      ],
      "maxFailures": 5
    },
    "proxySignatureDetection": {
      "sameDeviceDistinctCustomersPerDay": 2,
      "minSecondsFromSendToSign": 60
    },
    "anchor": {
      "externalTimestamp": true,
      "tsaProfile": "RFC3161"
    },
    "subjectRule": {
      "largeGaOnly": true,
      "excludedGroups": [
        "PG-AUTO"
      ],
      "contractDateFrom": "2026-07-01"
    },
    "kpi": {
      "collectionRate": "COMPLETED_LINKED / SUBJECT"
    },
    "retentionYears": 5,
    "retentionAnchors": [
      "SEAL",
      "COMPLETION",
      "CONTRACT_DATE"
    ],
    "retainUnlinked": true,
    "exceptionApproval": {
      "role": "MANAGER"
    },
    "masking": {
      "name": {
        "keepFirst": 1,
        "keepLast": 1,
        "maskChar": "*"
      },
      "phone": {
        "keepFirst": 3,
        "keepLast": 4,
        "maskChar": "*"
      },
      "birthDate": {
        "keepFirst": 0,
        "keepLast": 0,
        "maskChar": "*"
      }
    },
    "tenantOverridable": [
      "signDeadlineDays",
      "remoteLinkTtlHours",
      "channels",
      "identityCheck",
      "proxySignatureDetection",
      "anchor",
      "kpi",
      "retainUnlinked",
      "masking",
      "gateRequiresManager",
      "sessionTtlMinutes",
      "agentSignMethod"
    ],
    "validations": [
      {
        "id": "R-MIN-COMPARE",
        "stages": [
          "COMPARE",
          "SEAL"
        ]
      },
      {
        "id": "R-DISTINCT-INSURER",
        "stages": [
          "COMPARE",
          "SEAL"
        ]
      },
      {
        "id": "R-SAME-GROUP",
        "stages": [
          "COMPARE",
          "SEAL"
        ]
      },
      {
        "id": "R-PANEL",
        "stages": [
          "COMPARE",
          "SEAL"
        ]
      },
      {
        "id": "R-GRADE-REQUIRED",
        "stages": [
          "GRADE",
          "SEAL"
        ]
      },
      {
        "id": "R-GRADE-UNAVAILABLE",
        "stages": [
          "GRADE",
          "SEAL"
        ]
      },
      {
        "id": "R-RANK-MONOTONIC",
        "stages": [
          "GRADE",
          "SEAL"
        ]
      },
      {
        "id": "R-REASON",
        "stages": [
          "REASON",
          "SEAL"
        ]
      },
      {
        "id": "R-TEMP-PRODUCT",
        "stages": [
          "COMPARE",
          "SEAL"
        ]
      },
      {
        "id": "R-REQUESTED",
        "stages": [
          "REASON",
          "SEAL"
        ]
      },
      {
        "id": "R-SIGNER-SET",
        "stages": [
          "COMPLETE"
        ]
      },
      {
        "id": "R-FIELD-REQUIRED",
        "stages": [
          "REASON",
          "SEAL"
        ]
      }
    ]
  }
}
